{
  "id": "HH-DEMO",
  "name": "Dad",
  "age": 78,
  "photo": "/robert.svg",
  "height_build": "5ft 9in, slim",
  "medications": [
    {"name": "donepezil", "dose": "10 mg", "note": "nightly"},
    {"name": "metoprolol", "dose": "50 mg", "note": "morning"}
  ],
  "familiar_places": [
    {"name": "Palace of Fine Arts, walked there every morning", "lat": 37.8029, "lng": -122.4486},
    {"name": "Old flat on Chestnut St, lived there 30 years", "lat": 37.8003, "lng": -122.4350}
  ],
  "contacts": [
    {"id": "TM-PRIMARY", "name": "Sarah", "phone": "web", "tier": 1},
    {"id": "TM-MIKE", "name": "Mike", "phone": "web", "tier": 2},
    {"id": "TM-LINDA", "name": "Linda (neighbor)", "phone": "web", "tier": 3}
  ],
  "voice_id": "cartesia-voice-id-here",
  "home": {"lat": 37.8000, "lng": -122.4400, "radius_mi": 1.5}
}
